show_id,type,title,director,cast,country,date_added,release_year,rating,duration,listed_in,description,platform,imdb_rating
s8192,Movie,The Animal People,"Denis Hennelly, Casey Suchan",,United States,"March 11, 2020",2019,TV-MA,97 min,Documentaries,Animal rights protesters trying to shut down a facility that conducts animal testing are labeled terrorists by big business and law enforcement.,netflix,7.7
s8193,Movie,The Ant's Scream,Sameh Abdulaziz,"Amr Abdel-Geleel, Rania Yousef, Salloum Haddad, Hesham Al-Meligy, Farida Al-Gready, Ahmad Wafiq, Mohamed Abo El Hassan, Amr Sakr, Ahmed Gamal Saeed, Riham Ayman",Egypt,"June 13, 2019",2010,TV-14,108 min,"Comedies, Dramas, International Movies","Released after being wrongly imprisoned in Iraq, an Egyptian contractor returns home to a country on the brink of revolution.",netflix,
s8194,TV Show,The Apartment,,"Jamie Durie, Laurence Llewelyn-Bowen",Singapore," December 14, 2018",2014,TV-PG,2 Seasons,"International TV Shows, Reality TV","With their eyes on the grand prize, amateur designers push their creative limits in this reality competition show hosted by design icon Jamie Durie.",netflix,
s8195,Movie,The Apostate,Federico Veiroj,"Álvaro Ogalla, Marta Larralde, Bárbara Lennie, Vicky Peña, Juan Calot, Kaiet Rodriguez, Andrés Gertrúdix, Joaquín Climent, Álvaro Roig, Tino Martinez, Mercedes Hoyos","Spain, France, Uruguay","May 10, 2017",2015,TV-MA,80 min,"Comedies, Dramas, International Movies",A young man determined to renounce Catholicism by having his baptismal records excised is thwarted by church bureaucracy and his own inner conflicts.,netflix,5.8
s8196,Movie,The Art of the Steal,Jonathan Sobol,"Kurt Russell, Jay Baruchel, Katheryn Winnick, Chris Diamantopoulos, Kenneth Welsh, Jason Jones, Terence Stamp, Matt Dillon, Devon Bostick","Canada, United States","December 8, 2018",2013,R,90 min,"Action & Adventure, Comedies, Independent Movies","Crunch Calhoun, a daredevil motorcyclist and mostly reformed con artist, agrees to do one last job: helping his brother Nicky steal a priceless book.",netflix,6.3
s8197,Movie,The Art of War,Christian Duguay,"Wesley Snipes, Anne Archer, Maury Chaykin, Marie Matiko, Cary-Hiroyuki Tagawa, Michael Biehn, Donald Sutherland, Liliana Komorowska, James Hong","United States, Canada","July 1, 2020",2000,R,117 min,Action & Adventure,"Framed for the murder of an ambassador, a former member of the United Nations' elite covert action unit will do whatever it takes to clear his name.",netflix,5.7
s8198,Movie,The Assignment,Walter Hill,"Michelle Rodriguez, Sigourney Weaver, Tony Shalhoub, Anthony LaPaglia, Caitlin Gerard, Brent Langdon, Adrian Hough, Ken Kirzinger, Darryl Quon, Caroline Chan","France, Canada, United States","March 15, 2020",2016,R,95 min,Action & Adventure,A hitman has his body surgically altered into a woman's against his will. Now he has to track down the surgeon responsible and get his revenge.,netflix,4.7
s8199,Movie,The Autopsy of Jane Doe,André Øvredal,"Emile Hirsch, Brian Cox, Ophelia Lovibond, Michael McElhatton, Parker Sawyers, Jane Perry, Olwen Catherine Kelly","United Kingdom, United States","December 30, 2018",2016,R,86 min,"Horror Movies, Independent Movies, Thrillers",A father-son team of small-town coroners performs an autopsy on an unidentified woman with mysterious injuries and a terrifying secret.,netflix,6.8
s8200,TV Show,The Bachelor,,,,"December 1, 2019",2009,TV-14,1 Season,"Reality TV, Romantic TV Shows",A single man searches for his soulmate through a series of dates with 25 contestants ready to romance him for a chance at love.,netflix,
s8201,Movie,The Bachelors,Kurt Voelker,"J.K. Simmons, Josh Wiggins, Julie Delpy, Odeya Rush, Kevin Dunn, Kimberly Crandall, Jean Louisa Kelly, Charlie DePew, Tyrel Jackson Williams, Tom Amandes, Spencer List, Jacqueline Mazarella, Vanessa Howard, Harold Perrineau",United States,"February 21, 2018",2017,TV-14,100 min,Dramas,"After the death of his wife, a teacher and his son move to a new city, where emotional connections with two women help them begin to heal.",netflix,6.8
s8202,Movie,The Bad Education Movie,Elliot Hegarty,"Jack Whitehall, Joanna Scanlan, Iain Glen, Ethan Lawrence, Layton Williams, Kae Alexander, Weruche Opia, Nikki Runeckles, Charlie Wernham, Jack Binstead",United Kingdom,"December 15, 2018",2015,TV-MA,87 min,Comedies,"Britain's most ineffective but caring teacher takes his class to Cornwall for one last school trip, where anything could happen –
 and probably will.",netflix,5.8
s8203,Movie,The Bad Kids,"Keith Fulton, Louis Pepe",,United States,"April 1, 2017",2016,TV-MA,101 min,Documentaries,"In this documentary, teachers at a Mojave Desert high school adhere to a belief that compassion and life skills can profoundly help at-risk students.",netflix,7.0
s8204,Movie,The Bare-Footed Kid,Johnnie To,"Aaron Kwok, Lung Ti, Maggie Cheung, Chien-lien Wu, Paul Chun, Kenneth Tsang",Hong Kong,"August 16, 2018",1993,TV-14,83 min,"Action & Adventure, International Movies","While working at a family friend's business, a penniless orphan draws the attention of a corrupt competitor and is torn between divided loyalties.",netflix,6.4
s8205,Movie,The Basement,"Brian M. Conley, Nathan Ives","Mischa Barton, Jackson Davis, Cayleb Long, Tracie Thoms, Bailey Anne Borders",United States,"April 9, 2019",2018,TV-MA,89 min,"Horror Movies, Thrillers","Known for tortuous role-play with victims in his basement, a twisted serial killer abducts a musician who has a deeper connection to his mind games.",netflix,4.3
s8206,Movie,The Battle of Midway,John Ford,"Henry Fonda, Jane Darwell",United States,"March 31, 2017",1942,TV-14,18 min,"Classic Movies, Documentaries","Director John Ford captures combat footage of the Battle of Midway, an air and sea campaign that was a turning point in the war in the Pacific.",netflix,6.1
s8207,TV Show,The Beat,,"Henley Hii, Yise Loo, Aric Ho, Tiffany Leong, Issac Dang, Christy Yow",,"September 18, 2017",2012,TV-MA,1 Season,"International TV Shows, TV Dramas","The artistic pursuits of two childhood friends, an aspiring singer and a talented dancer, lead them to four other 20-somethings in a drumming group.",netflix,
s8208,TV Show,The Beginning of Life: The Series,Estela Renner,,Brazil,"November 11, 2016",2016,TV-PG,1 Season,"Docuseries, International TV Shows, Science & Nature TV","Using breakthroughs in technology and neuroscience, this series examines how environment affects infants – and how infants can affect our future.",netflix,
s8209,TV Show,The Bible's Buried Secrets,,Francesca Stavrakopoulou,United Kingdom,"February 1, 2019",2011,TV-14,1 Season,"British TV Shows, Docuseries, Science & Nature TV","Host Francesca Stavrakopoulou travels across the Middle East, offering extraordinary insights into the stories of the Old Testament.",netflix,5.5
s8210,TV Show,The Big Catch,,Ben Fogle,United Kingdom,"February 1, 2019",2015,TV-PG,1 Season,"British TV Shows, Reality TV","In a global competition, eight fishing enthusiasts battle extreme conditions and dangerous waters to be crowned the ultimate angler.",netflix,6.8
s8211,Movie,The Bill Murray Stories: Life Lessons Learned From a Mythical Man,Tommy Avallone,"Tommy Avallone, Bill Murray, Joel Murray, Peter Farrelly",United States,"December 31, 2018",2018,TV-MA,72 min,Documentaries,"This documentary highlights spontaneous encounters with the elusive, comedic veteran, who touches lives by simply showing up anywhere.",netflix,7.1
s8212,Movie,The Black Room,Rolfe Kanefsky,"Natasha Henstridge, Lukas Hassel, Lin Shaye, Dominique Swain, Augie Duke, Caleb Scott, James Duval, Tiffany Shepis",United States,"August 7, 2017",2016,TV-MA,95 min,Horror Movies,A couple's new dream home morphs into a nightmare after they learn that an evil and lustful spirit resides in their basement.,netflix,
s8213,Movie,The Blackcoat's Daughter,Osgood Perkins,"Emma Roberts, Kiernan Shipka, Lucy Boynton, Lauren Holly, James Remar, Greg Ellwand, Elana Krausz, Heather Tod Mitchell, Peter James Haworth, Emma Holzer","Canada, United States","May 18, 2019",2015,R,95 min,"Horror Movies, Independent Movies, Thrillers","When their parents fail to pick them up for winter break, two students stay on at an all-girls boarding school in the company of a terrible presence.",netflix,5.9
s8214,Movie,The Bleeder,Philippe Falardeau,"Liev Schreiber, Elisabeth Moss, Ron Perlman, Naomi Watts, Jim Gaffigan, Michael Rapaport, Pooch Hall, Morgan Spector, Jason Jones",United States,"March 29, 2019",2016,R,98 min,"Dramas, Sports Movies","Husband. Father. Fighter. Meet Chuck Wepner, the liquor salesman and self-proclaimed real-life inspiration behind Rocky Balboa.",netflix,6.5
s8215,TV Show,The Blue Planet: A Natural History of the Oceans,Alastair Fothergill,David Attenborough,United Kingdom,"October 10, 2015",2001,TV-G,1 Season,"British TV Shows, Docuseries, International TV Shows","David Attenborough narrates this definitive exploration of the marine world, from the familiar to the unknown, revealing the sea and its communities.",netflix,9.0
s8216,Movie,The Bomb,"Kevin Ford, Smriti Keshari, Eric Schlosser",,United States,"August 1, 2017",2016,TV-14,59 min,Documentaries,"Form, montage and mesmerizing kinetics propel this experimental meditation on the destructive power of the nuclear bomb, featuring music by The Acid.",netflix,6.5
s8217,TV Show,The Bomb Squad,,Christopher Eccleston,United Kingdom,"February 1, 2019",2011,TV-MA,1 Season,"British TV Shows, Docuseries",This documentary follows British bomb disposal teams in Afghanistan and the dangers they face in their methodical lives on the front lines of war.,netflix,7.7
s8218,Movie,The Book of Eli,"Albert Hughes, Allen Hughes","Denzel Washington, Gary Oldman, Mila Kunis, Ray Stevenson, Jennifer Beals, Evan Jones, Joe Pingue, Frances de la Tour, Michael Gambon, Tom Waits",United States,"July 1, 2019",2010,R,118 min,"Action & Adventure, Sci-Fi & Fantasy","Determined to protect a sacred text that promises to save humanity, Eli goes on a quest westward across the barren, postapocalyptic country.",netflix,6.9
s8219,Movie,The Boss's Daughter,Olivier Loustau,"Christa Théret, Olivier Loustau, Florence Thomassin, Patrick Descamps, Stéphane Rideau, Pierre Berriau, Deborah Grall, Vincent Martinez",France,"March 10, 2017",2015,TV-MA,98 min,"Dramas, International Movies, Romantic Movies","While working together, a married textile foreman and his boss’s daughter have a torrid love affair, stirring up hostility among the factory crew.",netflix,5.4
s8220,Movie,The Bounty Hunter,Andy Tennant,"Jennifer Aniston, Gerard Butler, Jason Sudeikis, Jeff Garlin, Ritchie Coster, Cathy Moriarty, Peter Greene, Joel Marsh Garland, Siobhan Fallon Hogan, Dorian Missick, Adam Rose, Christine Baranski, Carol Kane, Adam LeFevre",United States,"October 1, 2019",2010,PG-13,111 min,"Action & Adventure, Comedies, Romantic Movies","Bounty hunter Milo Boyd finds his latest assignment downright satisfying as he learns that the bail-jumper he must chase down is his ex-wife, Nicole.",netflix,5.6
s8221,Movie,The Box,Richard Kelly,"Cameron Diaz, James Marsden, Frank Langella, James Rebhorn, Holmes Osborne, Sam Oz Stone, Gillian Jacobs, Celia Weston, Deborah Rush",United States,"June 1, 2019",2009,PG-13,116 min,"Sci-Fi & Fantasy, Thrillers",A couple must decide whether to push a button that will net them a million dollars but that will also cause the death of a complete stranger.,netflix,5.6
s8222,Movie,The Boy,William Brent Bell,"Jim Norton, Rupert Evans, Ben Robson, Lauren Cohan, James Russell, Jett Klyne, Diana Hardcastle","United States, Canada, China","June 1, 2020",2016,PG-13,97 min,"Horror Movies, Independent Movies, Thrillers",A nanny is hired by a couple to look after their boy. She's shocked to learn that her charge is actually a doll that the couple treats like a human.,netflix,6.0
s8223,Movie,The Boy in the Striped Pajamas,Mark Herman,"Asa Butterfield, Vera Farmiga, David Thewlis, Rupert Friend, David Hayman, Jack Scanlon, Amber Beattie, Sheila Hancock, Richard Johnson, Jim Norton","United Kingdom, United States","January 1, 2019",2008,PG-13,95 min,"Dramas, Independent Movies, International Movies","When his family moves from Berlin to Poland, a young boy befriends a boy who lives on the other side of the fence, unaware he's a Jewish prisoner.",netflix,7.8
s8224,Movie,The Brave One,Neil Jordan,"Jodie Foster, Terrence Howard, Naveen Andrews, Carmen Ejogo, Nicky Katt, Mary Steenburgen, Lenny Venito, Zoë Kravitz, Jane Adams, Gordon MacDonald",United States,"November 1, 2019",2007,R,122 min,"Dramas, Thrillers",New York City radio host Erica Bain decides to take the law into her own hands after losing her fiancé in a brutal Central Park attack.,netflix,6.7
s8225,Movie,The Brawler,Ken Kushner,"Zach McGowan, Amy Smart, Joe Pantoliano, Burt Young, Tony Darrow, Nick Loeb, Taryn Manning, Jason James Richter",United States,"May 18, 2019",2019,TV-MA,95 min,"Dramas, Independent Movies, Sports Movies","Newly famous after challenging Muhammad Ali for a championship title, boxer Chuck Wepner spirals down the slippery slope of being a celebrity.",netflix,
s8226,Movie,The Breadwinner,Nora Twomey,"Saara Chaudry, Soma Chhaya, Ali Badshah, Soma Bhatia, Shaista Latif, Laara Sadiq, Kawa Ada, Noorin Gulamgaus","Ireland, Canada, Luxembourg, United States, United Kingdom, Philippines, India","February 20, 2018",2017,PG-13,93 min,"Children & Family Movies, Dramas, International Movies",A courageous 11-year-old Afghan girl disguises herself as a boy and takes on odd jobs to provide for her family when her father is arrested.,netflix,7.7
s8227,Movie,The Break-Up,Peyton Reed,"Vince Vaughn, Jennifer Aniston, Joey Lauren Adams, Cole Hauser, Jon Favreau, Jason Bateman, Judy Davis, Justin Long, Ivan Sergei, John Michael Higgins, Ann-Margret, Vernon Vaughn, Vincent D'Onofrio",United States,"July 16, 2019",2006,PG-13,107 min,"Comedies, Dramas, Romantic Movies",Cohabitating couple Gary and Brooke's petty spats turn into an all-out battle for their home condo.,netflix,5.8
s8228,Movie,The Bridge,Kunle Afolayan,"Chidinma Ekile, Ademola Adedoyin, Kunle Afolayan, Zack Orji, Tina Mba, Ayo Akinwale, Akim Mogaji, Ayo Mogaji, Ken Erics",Nigeria,"September 1, 2019",2017,TV-14,119 min,"Dramas, International Movies, Romantic Movies",A Yoruba prince and a young lady from a prominent Igbo family face tribal prejudice and parental pressure when they secretly wed.,netflix,
s8229,Movie,The Brothers Grimm,Terry Gilliam,"Matt Damon, Heath Ledger, Monica Bellucci, Lena Headey, Peter Stormare, Jonathan Pryce, Roger Ashton-Griffiths, Richard Ridings, Mackenzie Crook, Julian Bleach, Tomás Hanák, Laura Greenwood","United States, Czech Republic, United Kingdom","July 1, 2019",2005,PG-13,119 min,"Action & Adventure, Sci-Fi & Fantasy","Brothers Jake and Will Grimm travel from village to village, posing as exterminators of magical creatures. But in reality, they're expert con artists.",netflix,5.9
s8230,Movie,The Bucket List,Rob Reiner,"Jack Nicholson, Morgan Freeman, Sean Hayes, Beverly Todd, Alfonso Freeman, Rob Morrow, Rowena King, Christopher Stapleton, Ian Anthony Dale, Richard McGonagle",United States,"October 1, 2019",2007,PG-13,97 min,"Comedies, Dramas",Two terminally ill men bust out of the cancer ward with a plan to experience life to the fullest before they kick the bucket.,netflix,7.4
s8231,Movie,The Bulbul's Nest,Husam El-Gohari,"Kareem Mahmoud Abdel Aziz, Mai Selim, Sad Al-Saghir, Mahmood El-Laithi, Maher Essam, Dina",,"May 9, 2019",2013,TV-MA,96 min,"Comedies, International Movies","A taxi driver longs to be a pop singer, but the road to stardom is wrought with competition and struggle until he befriends a helpful belly dancer.",netflix,
s8232,Movie,The Bund,,Chow Yun Fat,Hong Kong,"September 20, 2018",1983,TV-14,103 min,"Action & Adventure, Dramas, International Movies","After losing everything, a young man rebuilds his life and finds love in 1920s Shanghai – all while rising to power in an organized crime syndicate.",netflix,
s8233,Movie,The Bye Bye Man,Stacy Title,"Douglas Smith, Lucien Laviscount, Cressida Bonas, Michael Trucco, Doug Jones, Carrie-Anne Moss, Faye Dunaway, Jenna Kanell, Erica Tremblay, Cleo King","United States, China","April 1, 2019",2017,PG-13,96 min,"Horror Movies, Thrillers",Three college students move into an off-campus house and discover they've unwittingly unleashed a supernatural killer known as the Bye Bye Man.,netflix,4.2
s8234,Movie,The Bygone,"Graham Phillips, Parker Phillips","Graham Phillips, Shawn Hatosy, Jamie McShane, Sydney Schafer, Tokala Black Elk, Jacqueline Toboni, Mike McColl, Jacob Ming-Trent",United States,"March 23, 2020",2019,TV-MA,106 min,"Independent Movies, Thrillers","His way of life under threat due to the oil fracking boom, a young rancher defends a Lakota woman and becomes entangled in human trafficking.",netflix,5.7
s8235,Movie,The Cakemaker,Ofir Raul Graizer,"Sarah Adler, Tim Kalkhof, Roy Miller, Zohar Shtrauss, Sandra Sade, Tamir Ben-Yehuda, Stephanie Stremler, Tagel Eliyahu","Israel, Germany","December 4, 2018",2017,TV-14,109 min,"Dramas, Independent Movies, International Movies","When a German baker travels to Jerusalem in search of his dead male lover’s family, his growing involvement with them may expose his truth.",netflix,7.3
s8236,TV Show,The Calling,Bumpy,,India,"April 1, 2019",2018,TV-MA,1 Season,"International TV Shows, Reality TV","Food-crazed travel junkies journey across India, completing bucket list challenges for a chance to win a once-in-a-lifetime scholarship.",netflix,
s8237,Movie,The Captive,Atom Egoyan,"Ryan Reynolds, Scott Speedman, Rosario Dawson, Mireille Enos, Kevin Durand, Alexia Fast, Christine Horne, Arsinée Khanjian, Ian Matthews, Bruce Greenwood, Aidan Shipley",Canada,"July 20, 2018",2014,R,112 min,"Dramas, Thrillers","Eight years after their daughter's abduction tore them apart, her parents receive enigmatic clues from the kidnapper hinting that she's still alive.",netflix,5.9
s8238,Movie,The Car,Elliot Silverstein,"James Brolin, Kathleen Lloyd, John Marley, R.G. Armstrong, John Rubinstein, Elizabeth Thompson, Roy Jenson, Kim Richards, Kyle Richards",United States,"June 1, 2020",1977,PG,96 min,"Cult Movies, Horror Movies","In his small Southwestern town, sheriff Wade Parent must find out who — or what — is running people down via a mysterious, driverless black sedan.",netflix,6.2
s8239,Movie,The Carter Effect,Sean Menard,Vince Carter,United States,"May 1, 2018",2017,TV-MA,60 min,"Documentaries, Sports Movies","Featuring eight-time NBA All-Star Vince Carter, this documentary takes an in-depth look at his impact on pop culture and the Canadian basketball scene.",netflix,7.1
s8240,Movie,The Case for Christ,Jon Gunn,"Mike Vogel, Erika Christensen, Faye Dunaway, Robert Forster, Frankie Faison, Mike Pniewski",United States,"November 21, 2017",2017,TV-PG,113 min,"Dramas, Faith & Spirituality","Bothered by his wife's unyielding belief in Christianity, an investigative reporter sets out to use verifiable facts to poke holes in her faith.",netflix,6.4
s8241,Movie,The Cell,Tarek Al Eryan,"Ahmed Ezz, Mohamed Mamdouh, Samer al Masri, Amina Khalil, Ahmed Safwat, Ahmed Salah Hosny, Aïcha Ben Ahmed, Rania Elkhatib, Riham Abdel Ghafour",Egypt,"June 13, 2019",2017,TV-MA,126 min,"Action & Adventure, Dramas, International Movies",A special operations officer vows to get revenge against the terrorist who killed his friend in a brutal attack.,netflix,6.4
s8242,Movie,The CEO,Kunle Afolayan,"Wale Ojo, Jimmy Jean-Louis, Hilda Dokubo, Nico Panagio, Aurélie Eliam, Peter King Nzioki Mwania, Fatym Layachi, Kemi Lala Akindoju, Angélique Kidjo",Nigeria,"September 1, 2019",2016,TV-14,109 min,"Dramas, International Movies, Thrillers",A group of executives heads to a telecommunications retreat to pick the firm's new CEO until they find themselves in a contest to win – and stay alive.,netflix,5.8
s8243,Movie,The Charnel House,Craig Moss,"Callum Blue, Nadine Velazquez, Makenzie Moss, Erik LaRay Harvey, Danielle Lauder, Andy Favreau, Kate Linder, Neil Thackaberry, Alden Tab",United States,"February 4, 2017",2016,R,93 min,"Horror Movies, Thrillers","After an architect transforms a slaughterhouse into trendy lofts, its new inhabitants discover that the structure is haunted by its evil past.",netflix,4.4
s8244,TV Show,The Chefs' Line,,"Dan Hong, Mark Olive, Melissa Leong, Maeve O'Meara",Australia,"August 1, 2019",2017,TV-14,1 Season,"International TV Shows, Reality TV",Home cooks face off against trained chefs to see if passion can beat profession in the kitchen in this reality competition show.,netflix,7.0
s8245,Movie,The Chord,Magdy Al-Hawwary,"Mostafa Shaban, Ghada Adel, Arwa Gouda, Ahmed Salah Al-Saadany, Ashraf Zaki, Sawsan Badr, Fatma Nasser, Said Saleh, Ali Hassanein, Majed Abdulazim",Egypt,"June 20, 2019",2010,TV-MA,101 min,"Dramas, International Movies, Music & Musicals","A detective investigates the murder of a young musician, whose philandering lifestyle leaves a long list of suspects and a lot of questions.",netflix,6.0
s8246,Movie,The Chosen,Antonio Chavarrías,"Alfonso Herrera, Hannah Murray, Henry Goodman, Julian Sands, Frances Barber, Emilio Echevarría, Alejandro Calva, Elvira Mínguez, Roger Casamajor, Luis Rosales, Javier Godino, Alexander Holtmann, Brontis Jodorowsky","Spain, Mexico","April 14, 2017",2016,TV-14,111 min,"Dramas, International Movies, Thrillers","In 1937, Spanish revolutionary Ramón trains as a Soviet spy, impersonating a wealthy Belgian as part of a plot to assassinate Leon Trotsky in Mexico.",netflix,
s8247,Movie,The Chosen Ones,David Pablos,"Nancy Talamantes, Óscar Torres, Leidi Gutiérrez, José Santillán Cabuto, Edward Coward, Alicia Quiñonez, Raquel Presa, Susana Pérez, Gisela Madrigal, Jorge Calderon, Felipe Tututi","Mexico, France","May 8, 2016",2015,TV-MA,107 min,"Dramas, Independent Movies, International Movies","Young Ulises falls in love with teen Sofia, even as he is forced to lure her into his family's prostitution ring. Now he'll do anything to rescue her.",netflix,6.7
s8248,Movie,The Christmas Candle,John Stephenson,"Hans Matheson, Samantha Barks, Lesley Manville, Sylvester McCoy, Susan Boyle, John Hannah, Barbara Flynn, James Cosmo","United Kingdom, United States","November 1, 2019",2013,PG,100 min,"Dramas, Faith & Spirituality",A progressive new minister's arrival in a small village threatens to end an age-old tradition that brings a yuletide miracle to one of the residents.,netflix,6.2
s8249,Movie,The Christmas Project,Michael Buster,"Jacob Buster, Anson Bagley, Grace Hallows, Josh Reid, Cooper Daniel Johnson, Alison Akin Clark, Brian Neal Clark, Evan Clark, Caitlin E.J. Meyer, Gabe White",United States,"March 1, 2019",2016,TV-PG,92 min,"Children & Family Movies, Comedies",Four brothers prepare for war when they're forced to deliver secret holiday gifts to the school bullies. But they soon learn kindness goes a long way.,netflix,5.5
s8250,Movie,The Cincinnati Kid,Norman Jewison,"Steve McQueen, Edward G. Robinson, Ann-Margret, Karl Malden, Tuesday Weld, Joan Blondell, Rip Torn, Jack Weston, Cab Calloway, Jeff Corey, Theo Marcuse",United States,"November 1, 2019",1965,TV-14,103 min,"Classic Movies, Dramas","In Depression-era New Orleans, cocksure stud poker player Eric Stoner – the titular Cincinnati Kid – challenges longtime champ Lancey ""The Man"" Howard to a showdown at the table, where a war of wills – and nerve – ensues.",netflix,7.3
s8251,TV Show,The Code,,Marcus du Sautoy,United Kingdom,"February 1, 2018",2011,TV-PG,1 Season,"British TV Shows, Docuseries, International TV Shows","In this three-part documentary series, host Marcus du Sautoy examines the mathematical code underlying all of life on Earth and the universe itself.",netflix,
s8252,Movie,The Company Men,John Wells,"Ben Affleck, Chris Cooper, Kevin Costner, Tommy Lee Jones, Maria Bello, Rosemarie DeWitt, Craig T. Nelson, John Doman, Tonye Patano, Cady Huffman",United States,"July 28, 2018",2010,R,105 min,"Dramas, Independent Movies",A successful businessman comes face-to-face with America's downsizing epidemic when he loses his job and is forced to take a construction gig.,netflix,6.7
s8253,Movie,The Competition,Harvey Lowry,"Thora Birch, Chris Klein, Claire Coffee, David Blue, Kelsey Tucker, Michael Draper, Jason Tobias, Gabrielle Stone, Catherine Johnson, Tiffany Fallon",United States,"July 23, 2019",2018,TV-14,103 min,"Comedies, Romantic Movies","After developing an ""infidelity formula"" said to repel cheating, a popular blogger crosses paths with a charming lawyer willing to put it to the test.",netflix,4.5
s8254,Movie,The Confirmation,Bob Nelson,"Clive Owen, Maria Bello, Patton Oswalt, Jaeden Lieberher, Matthew Modine, Stephen Tobolowsky, Tim Blake Nelson, Robert Forster",Canada,"February 6, 2019",2016,PG-13,101 min,"Comedies, Dramas, Independent Movies",A divorced handyman with a drinking problem bonds with his 8-year-old son when a search for his stolen toolbox leads to a series of misadventures.,netflix,6.4
s8255,Movie,The Congress,Ari Folman,"Robin Wright, Harvey Keitel, Jon Hamm, Paul Giamatti, Kodi Smit-McPhee, Danny Huston, Sami Gayle, Michael Stahl-David, Michael Landes, Sarah Shahi","Israel, Germany, Poland, Luxembourg, Belgium, France, United States","August 23, 2019",2013,TV-MA,123 min,"Dramas, International Movies, Sci-Fi & Fantasy",Actress Robin Wright plays herself in this surreal drama about a film star who agrees to have her digital image recorded for reuse in future films.,netflix,6.5
s8256,Movie,The Consul's Son,Amr Arafa,"Khaled Saleh, Ghada Adel, Ahmed el-Sakka, Khaled Sarhan, Sawsan Badr, Mustafa Haridi",Egypt,"April 25, 2019",2011,TV-14,114 min,"Comedies, International Movies, Thrillers",A notorious forger known for his ability to create fake passports and visas finds himself the target of a con man's ruse.,netflix,
