show_id,type,title,director,cast,country,date_added,release_year,rating,duration,listed_in,description,platform,imdb_rating
s8064,Movie,Sparkle,Sam O'Steen,"Tony King, Mary Alice, Irene Cara, Dorian Harewood, Paul Lambert, Beatrice Winde, Lonette McKee",United States,"November 1, 2019",1976,PG,98 min,"Dramas, Music & Musicals","In 1950s Harlem, three singing sisters hit the big time and end up losing one another in this musical melodrama inspired by the Supremes.",netflix,6.8
s8065,TV Show,Spartacus,,"Andy Whitfield, Liam McIntyre, Dustin Clare, John Hannah, Manu Bennett, Lucy Lawless, Peter Mensah, Nick E. Tarabay, Viva Bianca, Lesley-Ann Brandt, Jai Courtney, Daniel Feuerriegel",United States," February 1, 2015",2013,TV-MA,4 Seasons,"TV Action & Adventure, TV Dramas","A Thracian man is condemned to a brutal death in the arena, only to outlast his executioners and be reborn as the enslaved gladiator Spartacus.",netflix,
s8066,Movie,Speech & Debate,Dan Harris,"Liam James, Sarah Steele, Austin McKenzie, Roger Bart, Janeane Garofalo, Wendi McLendon-Covey, Kal Penn, Kimberly Williams-Paisley, Skylar Astin, Edgar Arreola, Sarah Baker",United States,"July 6, 2017",2017,PG-13,96 min,"Comedies, Dramas, Independent Movies","Fed up with the hypocrisy of the adults around them, three creative high school misfits revive an old debate club as a way to fight back.",netflix,5.9
s8067,Movie,Speed Is My Need,Mark Sloper,,United Kingdom,"January 9, 2020",2019,TV-14,75 min,"Documentaries, Sports Movies","This daredevil documentary trails behind and into the minds of the biggest names in one of the world's most dangerous sports, superbike racing.",netflix,5.8
s8068,Movie,Spider-Man 3,Sam Raimi,"Tobey Maguire, Kirsten Dunst, James Franco, Thomas Haden Church, Topher Grace, Bryce Dallas Howard, Rosemary Harris, J.K. Simmons, James Cromwell, Theresa Russell, Dylan Baker, Bill Nunn, Bruce Campbell, Elizabeth Banks",United States,"November 1, 2019",2007,PG-13,139 min,"Action & Adventure, Sci-Fi & Fantasy",The seemingly invincible Spider-Man goes up against an all-new crop of villains in the third installment of the blockbuster adventure series.,netflix,6.2
s8069,Movie,Spider-Man: Into the Spider-Verse,"Peter Ramsey, Rodney Rothman, Bob Persichetti","Shameik Moore, Jake Johnson, Hailee Steinfeld, Brian Tyree Henry, Lauren Vélez, Mahershala Ali, Lily Tomlin, Kathryn Hahn, Liev Schreiber, Kimiko Glenn, Nicolas Cage, John Mulaney",United States,"June 26, 2019",2018,PG,117 min,"Action & Adventure, Comedies","After being bitten by a radioactive spider, Brooklyn teen Miles Morales gets a crash course in web-slinging from his alternate-dimension counterparts.",netflix,8.4
s8070,Movie,Spitfire: The Plane that Saved the World,"David Fairhead, Anthony Palmer",Charles Dance,United Kingdom,"November 1, 2019",2018,TV-14,95 min,Documentaries,"In this epic documentary, last-surviving veterans trace the history of a legendary fighter aircraft that dominated the air during the Battle of Britain.",netflix,7.6
s8071,TV Show,Splash and Bubbles,,"John Tartaglia, Leslie Carrara-Rudolph, Raymond Carr, Aymee Garcia",United States," August 13, 2018",2018,TV-Y,2 Seasons,Kids' TV,"Curious pals Splash, Bubbles, Dunk and Ripple have fun exploring new places, making new friends and learning all about their amazing ocean home.",netflix,
s8072,Movie,Spotlight,Tom McCarthy,"Mark Ruffalo, Michael Keaton, Rachel McAdams, Liev Schreiber, John Slattery, Brian d'Arcy James, Stanley Tucci, Billy Crudup, Paul Guilfoyle, Jamey Sheridan",United States,"July 22, 2020",2015,R,129 min,"Dramas, Independent Movies",A team of reporters and editors at the Boston Globe relentlessly investigate a shocking child molestation cover-up by the Catholic Church.,netflix,8.1
s8073,Movie,Spring Breakers,Harmony Korine,"James Franco, Vanessa Hudgens, Selena Gomez, Ashley Benson, Rachel Korine, Jeff Jarrett, Gucci Mane, Heather Morris, Ash Lendzion, Emma Holzer","United States, France","January 10, 2021",2012,R,94 min,"Comedies, Cult Movies, Dramas","Four cash-strapped college women run afoul of the law — and fall in with a shady hustler — as they join the annual rite of bikinis, beer and debauchery.",netflix,5.3
s8074,Movie,Sprinter,Storm Saulter,"Dale Elliott, Kadeem Wilson, Dennis Titus, David Alan Grier, Shantol Jackson, Lorraine Toussaint, Bryshere Gray, Quera South, Aiden Moodie","Jamaica, United States","April 15, 2020",2018,TV-MA,112 min,"Dramas, International Movies, Sports Movies","When a Jamaican teen hopes to use track to reunite him with his mother in America, family dysfunction at home threatens to knock his plans off course.",netflix,6.2
s8075,Movie,Spy Kids,Robert Rodriguez,"Antonio Banderas, Carla Gugino, Alan Cumming, Teri Hatcher, Cheech Marin, Danny Trejo, Robert Patrick, Tony Shalhoub, Alexa PenaVega, Daryl Sabara",United States,"April 1, 2019",2001,PG,88 min,"Children & Family Movies, Comedies",The tables are turned when pint-sized kids Carmen and Juni must rescue their secret-agent parents from the diabolical clutches of Alexander Minion.,netflix,5.5
s8076,Movie,Spy Kids 2: The Island of Lost Dreams,Robert Rodriguez,"Antonio Banderas, Carla Gugino, Alexa PenaVega, Daryl Sabara, Steve Buscemi, Mike Judge, Danny Trejo, Cheech Marin, Matt O'Leary, Emily Osment, Ricardo Montalban, Holland Taylor, Alan Cumming",United States,"March 8, 2019",2002,PG,100 min,"Children & Family Movies, Comedies","Spy kids Carmen and Juni Cortez team up with two other pint-size secret agents, Gary and Gerti Giggles, in order to take on an evil scientist.",netflix,5.2
s8077,Movie,Spy Kids 3: Game Over,Robert Rodriguez,"Daryl Sabara, Sylvester Stallone, Ricardo Montalban, Alexa PenaVega",United States,"April 1, 2019",2003,PG,83 min,"Children & Family Movies, Comedies","Carmen gets caught in a virtual reality game designed by the kids' new nemesis, the Toymaker, and it's up to Juni to save her by beating the game.",netflix,4.3
s8078,Movie,Spy Time,Javier Ruiz Caldera,"Imanol Arias, Quim Gutiérrez, Alexandra Jiménez, Berto Romero, Carlos Areces, Eduardo Gómez, Dani El Rojo, Emilio Gutiérrez Caba, Rossy de Palma, Sílvia Abril",Spain,"June 1, 2016",2015,TV-MA,93 min,"Action & Adventure, Comedies, International Movies","When his girlfriend dumps him for being a bore, a working stiff discovers that his father is a secret agent and a dangerous thug is targeting them.",netflix,6.1
s8079,Movie,St. Agatha,Darren Lynn Bousman,"Sabrina Kern, Carolyn Hennesy, Courtney Halverson, Shaun Fletcher, Lindsay Seim, Hannah Fierman, Trin Miller, Seth Michaels, Justin Miles",United States,"August 8, 2019",2018,TV-MA,103 min,"Horror Movies, Independent Movies","Unwed and pregnant, a young woman flees her abusive home in 1950s Georgia and takes refuge at a mysterious convent with a terrible secret.",netflix,4.9
s8080,Movie,Staged Killer,Christopher Ray,"Chrishell Hartley, Jason Dolley, Darrin Dewitt Henson, Nicole Bilderback, Charlie O'Connell, Chasty Ballesteros, Lyman Chen, Declan Joyce, Frank Rossi, Josh Nuncio",United States,"June 28, 2019",2019,TV-14,88 min,Thrillers,"After a popular morning television host bumps into an old acquaintance with a dark past, her professional and personal lives begin to unravel.",netflix,3.5
s8081,Movie,Standoff,Adam Alleca,"Thomas Jane, Laurence Fishburne, Joanna Douglas, John Tench, Ted Atherton, Jim Watson, Ella Ballentine",Canada,"December 11, 2018",2015,R,86 min,Action & Adventure,"After witnessing an assassin's slaughter, a young girl holes up in a farmhouse with a suicidal vet, who must use wits and guts to fend off the killer.",netflix,
s8082,Movie,Star Men,Alison E. Rose,,"Canada, United States, United Kingdom","February 5, 2017",2015,TV-14,88 min,Documentaries,Four astronomers from England celebrate 50 years of friendship and achievement by taking a reflective road trip through the American Southwest.,netflix,6.5
s8083,Movie,Star Wars: Episode VIII: The Last Jedi,Rian Johnson,"Mark Hamill, Carrie Fisher, Adam Driver, Daisy Ridley, John Boyega, Oscar Isaac, Andy Serkis, Lupita Nyong'o, Domhnall Gleeson, Anthony Daniels, Gwendoline Christie, Kelly Marie Tran, Laura Dern, Frank Oz, Benicio Del Toro, Warwick Davis, Noah Segan, Jimmy Vee, Joonas Suotamo, Joseph Gordon-Levitt, Tim Rose, Paul Kasey, Matthew Sharp, Adrian Edmondson, Amanda Lawrence, Justin Theroux",United States,"June 26, 2018",2017,PG-13,152 min,"Action & Adventure, Children & Family Movies, Sci-Fi & Fantasy","As the remnants of the Resistance flee Kylo Ren and the First Order, Rey seeks out Luke Skywalker – but he wants nothing more to do with the Force.",netflix,6.9
s8084,TV Show,Star-Crossed,,"Aimee Teegarden, Matt Lanter, Grey Damon, Malese Jow, Greg Finley, Natalie Hall, Titus Makin Jr., Chelsea Gilligan",United States,"April 16, 2015",2014,TV-14,1 Season,"Romantic TV Shows, TV Dramas, TV Sci-Fi & Fantasy",The passionate love between an alien boy and a human girl grows more and more dangerous as they face the wrath of their families and communities.,netflix,7.3
s8085,Movie,Starred Up,David Mackenzie,"Jack O'Connell, Ben Mendelsohn, Rupert Friend, Sam Spruell, Anthony Welsh, David Ajala, Peter Ferdinando, Gershwyn Eustache Jnr, Ashley Chin, Raphael Sowole, Gilly Gilchrist, Tommy McDonnell",United Kingdom,"August 29, 2019",2013,TV-MA,106 min,"Dramas, Independent Movies, International Movies","A British juvenile offender's violent temper gets him transferred to an adult prison, where he encounters his estranged father.",netflix,7.4
s8086,TV Show,Station Horizon,,"Bernard Yerlès, Roland Vouilloz, Gaspard Boesch, Alexandra Vandernoot, Marie Fontannaz, Lavinia Longhi, Baptiste Gilliéron",Switzerland,"September 1, 2016",2015,TV-MA,1 Season,"International TV Shows, TV Comedies, TV Dramas","Ex-con Joris returns to his Swiss hometown, a community obsessed with American culture and ideals, to start over and save his family's gas station.",netflix,7.5
s8087,Movie,Stealing History,"Ola Flyum, David Hebditch",Nicolas Hope,United States,"July 1, 2016",2006,TV-PG,52 min,"Documentaries, International Movies","Journalists expose how smugglers, dealers, collectors and scholars promote plunder of ancient artifacts from war-torn Iraq, Afghanistan and Pakistan.",netflix,6.7
s8088,Movie,Step Brothers,Adam McKay,"Will Ferrell, John C. Reilly, Mary Steenburgen, Richard Jenkins, Adam Scott, Kathryn Hahn, Andrea Savage, Lurie Poston, Elizabeth Yozamp, Logan Manus, Rob Riggle",United States,"November 1, 2019",2008,R,98 min,Comedies,"Brennan and Dale might be grown men, but that doesn't stop a childish sibling rivalry from erupting after Brennan's mom marries Dale's dad.",netflix,6.9
s8089,Movie,Step Outside,Wael Ihsan,"Kareem Mahmoud Abdel Aziz, Khaled El Sawy, Ahmed Fathy, Malak Koura, Ashraf Abdel Baqi",Egypt,"June 6, 2019",2018,TV-14,89 min,"Comedies, International Movies","A down-on-his-luck man reads a book, only to have its characters materialize and take over his life.",netflix,4.6
s8090,Movie,Stephanie,Akiva Goldsman,"Shree Cooks, Frank Grillo, Anna Torv",United States,"September 1, 2018",2017,R,86 min,Horror Movies,"A menacing, unseen force stalks a young girl living by herself in a suburban house, where she's surrounded by reminders of her once-happy family.",netflix,
s8091,Movie,Sthaniya Sambaad,"Arjun Gourisaria, Moinak Biswas",Suman Mukhopadhyay,India,"March 15, 2018",2010,TV-14,106 min,"Dramas, International Movies","In post-Partition Kolkata, a young Bengali poet from an urban colony wanders the city in search of the woman he loves and a channel for his sorrows.",netflix,
s8092,Movie,Still,"Chatchai Katenut, Manussa Vorasingha, Tanwarin Sukkhapisit, Poj Arnon","Mai Charoenpura, Akara Amarttayakul, Supakson Chaimongkol, Kachapa Toncharoen, Wiradit Srimalai, Vasana Chalakorn, Ratchanont Sukpragawp, Arisara Thongborisut",Thailand,"September 14, 2018",2010,TV-MA,100 min,"Horror Movies, International Movies","A haunted hotel, a body in a water tank, a nightclub fire and a prison death comprise four horror tales taken from Thailand's newspaper headlines.",netflix,
s8093,Movie,Stink!,Jon J. Whelan,Jeffrey Hollender,United States,"November 1, 2018",2015,TV-PG,91 min,Documentaries,"After noting a strange odor in his child’s pajamas, a single dad’s search for the source uncovers potentially toxic secrets of the chemical industry.",netflix,7.2
s8094,TV Show,Stoked,,"Terry McGurrin, Katie Crown, Kristin Fairlie, Mazin Elsadig, Anastasia Phillips, Arnold Pinnock, Jamie Spilchuk, Lauren Lipson, Fiona Reid, Jeff Geddis","United States, Canada","December 16, 2017",2010,TV-PG,1 Season,Kids' TV,Six teenage groms come together one summer to share a dream: to work at the world-renowned Surfer's Paradise Resort on the legendary Sunset Island.,netflix,
s8095,TV Show,Stone Age,,"Samantha Moon, Nancy Kim, Jacqueline Youn, Mike Yantzi, Anna Paik, Matt Anipen, Josh Schwartzentruber",South Korea,"July 1, 2019",2017,TV-Y7,1 Season,"Kids' TV, Korean TV Shows","Woody sets out to become the Stone Age's best animal trainer with a little help from his faithful pet dinosaur, Moga.",netflix,5.3
s8096,Movie,Stonehearst Asylum,Brad Anderson,"Kate Beckinsale, Jim Sturgess, David Thewlis, Brendan Gleeson, Ben Kingsley, Michael Caine, Jason Flemyng, Sophie Kennedy Clark, Sinéad Cusack, Edmund Kingsley",United States,"September 8, 2017",2014,PG-13,113 min,"Horror Movies, Thrillers","In 1899, a young doctor arrives at an asylum for an apprenticeship and becomes suspicious of his mentor's methods while falling for a female patient.",netflix,6.8
s8097,Movie,Stop at Nothing: The Lance Armstrong Story,Alex Holmes,,"Australia, United Kingdom, United States, New Zealand, Italy, France","February 15, 2015",2014,NR,100 min,"Documentaries, International Movies, Sports Movies","An athlete dupes the world with his tale of miraculous recovery from cancer, becoming a sports hero and beacon of hope, but can he outpace the truth?",netflix,7.5
s8098,TV Show,Storage Wars: Northern Treasures,,"Ursula Stolf, Paul Kenny, Bogart Kenny, Roy Dirnbeck, Don Reinhart, Rick Coffill, Cindy Hayden",United States,"July 22, 2019",2015,TV-MA,1 Season,"International TV Shows, Reality TV","In Canada, a colorful collection of treasure-seeking scavengers bid on the largely unknown contents of repossessed and abandoned storage units.",netflix,
s8099,Movie,Story of an Egg,Raj B. Shetty,"Raj B. Shetty, Usha Bhandary, Shailashree, Prakash Tuminadu, Amrutha Naik, Shreya Anchan, VJ Vineeth, Rahul Amin, Deepak Rai Panaje, Ramdas",India,"October 15, 2017",2017,TV-PG,132 min,"Comedies, International Movies, Romantic Movies","When an astrologer gives him one year to find a mate or face being alone forever, a professor sets out to find a bride despite serious obstacles.",netflix,8.0
s8100,Movie,Straight Up,James Sweeney,"James Sweeney, Katie Findlay, Randall Park, Hillary Anne Matthews, James Scully, Betsy Brandt",United States,"June 26, 2020",2020,TV-MA,96 min,"Comedies, Independent Movies, LGBTQ Movies","When a gay brainiac with OCD questions his identity, he enters a romantic relationship with a woman, leaving sex and physical intimacy out of it.",netflix,
s8101,Movie,Strange but True,Rowan Athale,"Amy Ryan, Nick Robinson, Margaret Qualley, Greg Kinnear, Blythe Danner, Brian Cox, Connor Jessup",Canada,"August 30, 2020",2019,PG-13,96 min,"Dramas, Thrillers",A young woman rattles her former boyfriend’s family when she reveals she is pregnant with his child — despite his death five years ago.,netflix,5.9
s8102,Movie,Stranger than Fiction,Marc Forster,"Will Ferrell, Maggie Gyllenhaal, Dustin Hoffman, Queen Latifah, Emma Thompson, Kristin Chenoweth, Tony Hale, Tom Hulce, Linda Hunt","United States, United Kingdom","October 1, 2020",2006,PG-13,113 min,"Comedies, Romantic Movies","As a writer ponders how to kill off her main character, the man begins hearing her voice in his head and realizes that his days are numbered.",netflix,7.5
s8103,TV Show,Strawberry Shortcake: Berry Bitty Adventures,,"Anna Cummer, Janyse Jaud, Andrea Libman, Britt McKillip, Ingrid Nilson, Ashleigh Ball","France, United States, Canada","January 1, 2016",2015,TV-Y,1 Season,Kids' TV,"Join Strawberry Shortcake and her berry best friends in the whimsical land of Berry Bitty City, where they learn about teamwork and decision-making.",netflix,
s8104,Movie,Strictly Ballroom,Baz Luhrmann,"Paul Mercurio, Tara Morice, Bill Hunter, Pat Thomson, Gia Carides, Peter Whitford, Barry Otto, John Hannan","Australia, United Kingdom","January 1, 2020",1992,PG,95 min,"Classic Movies, Comedies, Romantic Movies","Dumped by his partner just before a major dance competition, gifted hoofer Scott Hastings is forced to take a graceless neophyte as his new partner.",netflix,7.2
s8105,Movie,Strike a Pose,"Ester Gould, Reijer Zwaan",,"Netherlands, Belgium","April 7, 2017",2016,TV-MA,85 min,"Documentaries, International Movies, LGBTQ Movies","A quarter-century later, this documentary relocates the male dancers who backed Madonna on her 1990 Blond Ambition tour, as seen in ""Truth or Dare.""",netflix,7.2
s8106,Movie,Stripes,Ivan Reitman,"Bill Murray, Harold Ramis, Warren Oates, P.J. Soles, Sean Young, John Candy, John Larroquette, John Voldstad, John Diehl, Lance LeGault, Judge Reinhold",United States,"September 1, 2019",1981,R,106 min,"Classic Movies, Comedies, Cult Movies","After losing everything, an indolent sad sack impulsively joins the U.S. Army and cajoles his best friend into enlisting, too.",netflix,6.9
s8107,Movie,Striptease,Andrew Bergman,"Demi Moore, Burt Reynolds, Armand Assante, Ving Rhames, Robert Patrick, Paul Guilfoyle, Jerry Grayson, Rumer Willis, Robert Stanton, William Hill",United States,"January 1, 2021",1996,R,117 min,"Comedies, Dramas",A former FBI employee works as a stripper to finance her custody battle for her daughter when a secretly shady congressman takes an interest in her.,netflix,4.5
s8108,TV Show,Strong Girl Bong-soon,,"Park Bo-young, Park Hyung-sik, Ji Soo, Shim Hye-jin, Yu Jae-myeong, Jeon Seok-ho, Im Won-hee, Kim Won-hae",South Korea,"November 24, 2019",2017,TV-14,1 Season,"Crime TV Shows, International TV Shows, Korean TV Shows","Born with supernatural strength, Bong-soon fights evil and procures justice while getting tangled in a love triangle with her CEO boss and cop crush.",netflix,8.2
s8109,Movie,Stronger Than the World,Afonso Poyart,"José Loreto, Cleo Pires, Milhem Cortaz, Jackson Antunes, Claudia Ohana, Rômulo Arantes Neto, Paloma Bernardi, Thaila Ayala, Rafinha Bastos, Felipe Titto",Brazil,"February 11, 2017",2016,NR,123 min,"Action & Adventure, Dramas, International Movies","After a tough upbringing, natural-born fighter José Aldo confronts his personal demons in his quest to become an MMA champion in this sports biopic.",netflix,7.1
s8110,TV Show,Strongland,,,,"January 18, 2019",2018,TV-PG,1 Season,"Docuseries, International TV Shows","From Spain's countryside to Scotland's stony terrain, this collection of uplifting documentaries explores the cultural roots of great strongman traditions.",netflix,7.3
s8111,Movie,Stuart Little 2,Rob Minkoff,"Michael J. Fox, Geena Davis, Hugh Laurie, Jonathan Lipnicki, Nathan Lane, Melanie Griffith, James Woods, Steve Zahn",United States,"January 1, 2020",2002,PG,78 min,"Children & Family Movies, Comedies","Zany misadventures are in store as lovable city mouse Stuart and his human brother, George, raise the roof in this sequel to the 1999 blockbuster.",netflix,5.5
s8112,Movie,Submission,J.M. Berrios,"Scott Pryor, Darrin Dewitt Henson, Eric Roberts, Kevin Sizemore, Lorynn York, John Gray, Sara McMann, Ovince Saint Preux",United States,"November 11, 2019",2019,TV-MA,95 min,"Action & Adventure, Dramas","After a near-death trip home, a Marine looking to help his comrade survive returns to the underground world of MMA, where new battles await.",netflix,
s8113,Movie,Suburra,Stefano Sollima,"Pierfrancesco Favino, Elio Germano, Claudio Amendola, Alessandro Borghi, Greta Scarano, Giulia Gorietti, Jean-Hugues Anglade, Antonello Fassari, Lidia Vitale","Italy, France","October 14, 2015",2015,NR,135 min,"Dramas, International Movies, Thrillers",A grueling battle over turning a seaside town near Rome into a gambling paradise exposes criminal rivalries and endemic corruption on a grand scale.,netflix,7.4
s8114,Movie,Suckseed,Chayanop Boonprakob,"Jirayu La-ongmanee, Pachara Chirathivat, Nattasha Nauljam, Thawat Pornrattanaprasert",Thailand,"September 5, 2018",2011,TV-MA,130 min,"Comedies, International Movies, Music & Musicals","When his boyhood crush Ern returns, Ped forms a band with his friend to impress her. Romantic rivalries bloom after the talented Ern joins the group.",netflix,7.4
s8115,Movie,Sudani from Nigeria,Zakariya,"Soubin Shahir, Samuel Abiola Robinson, Savithri Sredharan, Aneesh Menon",India,"August 1, 2018",2018,TV-14,115 min,"Comedies, Dramas, International Movies","When a soccer club manager brings one of his injured foreign players home to recuperate, they form an unlikely bond despite their cultural differences.",netflix,8.2
s8116,Movie,Suicide (Hitabdut),Benny Fredman,"Mali Levi, Rotem Keinan, Dror Keren, Igal Naor",Israel,"July 1, 2016",2014,TV-MA,114 min,"International Movies, Thrillers","A failed businessman must kill himself to pay off a loan shark or his family will die, but a detective discovers the case turns on a shocking secret.",netflix,5.8
s8117,Movie,Suite Française,Saul Dibb,"Michelle Williams, Matthias Schoenaerts, Kristin Scott Thomas, Sam Riley, Ruth Wilson, Tom Schilling, Harriet Walter, Alexandra Maria Lara, Margot Robbie, Lambert Wilson","United Kingdom, France, Canada, Belgium, United States","June 5, 2017",2014,TV-MA,107 min,"Dramas, International Movies, Romantic Movies","Waiting for news of her prisoner-of-war husband, a French woman in Nazi-occupied France reluctantly falls for a German officer quartering in her home.",netflix,7.0
s8118,TV Show,Suits,,"Jang Dong-gun, Park Hyung-sik, Jin Hee-kyung, Chae Jung-an, Ko Sung-hee, Choi Guy-hwa, Kim Young-ho, Lee Sang-yi",South Korea,"December 1, 2019",2018,TV-MA,1 Season,"International TV Shows, Korean TV Shows, TV Comedies",A renowned corporate attorney at a prestigious firm gambles on a dropout with a photographic memory but no law degree to help on high-stakes cases.,netflix,7.4
s8119,Movie,Summer Night,Joseph Cross,"Ellar Coltrane, Callan McAuliffe, Ian Nelson, Lana Condor, Analeigh Tipton, Melina Vidler, Bill Milner, Justin Chatwin, Ella Hunt, Elena Kampouris, Victoria Justice, Khris Davis, Hayden Szeto",United States,"March 19, 2020",2019,TV-MA,93 min,"Comedies, Dramas, Romantic Movies",A group of 20-somethings in a small town experience a variety of personal and relationship issues leading up to a gathering at the local watering hole.,netflix,4.8
s8120,Movie,Summer of '92,Kasper Barfoed,"Ulrich Thomsen, Henning Jensen, Mikkel Boe Følsgaard, Cyron Melville, Esben Smed Jensen, Gustav Dyekjaer Giese, Jon Lange, Allan Hyde, Johannes Lassen, Morten Vang Simonsen","Denmark, United Kingdom, Sweden","July 10, 2016",2015,TV-MA,94 min,"Dramas, International Movies, Sports Movies","When a quirk of fate kicks the Danish national soccer team into the European Championship final, the coach must whip his unprepared squad into shape.",netflix,6.9
s8121,Movie,Sunrise,Partho Sen-Gupta,"Adil Hussain, Tannishtha Chatterjee, Gulnaaz Ansari, Komal Gupta, Esha Amlani, Ashalata Wabgaonkar, Hridaynath Jadhav, Chinmay Kambli, Nandini Bora, Komal Gawade","India, France","March 15, 2017",2014,TV-MA,85 min,"Dramas, Independent Movies, International Movies","While investigating a child kidnapping, a Mumbai police inspector is haunted by a shadowy dream figure and memories of his own abducted daughter.",netflix,
s8122,TV Show,Super Bheem,,"Sonal Kaushal, Rupa Bhimani, Julie Tejwani, Sabina Malik, Jigna Bharadhwaj, Rajesh Kawa",India,"June 28, 2019",2019,TV-Y,1 Season,Kids' TV,"In this 3D-animated spinoff from the Chhota Bheem series, valiant superhero Bheem goes beyond his village to fight the good fight across the universe.",netflix,
s8123,Movie,Super Bheem Bana Vajraveer,Sumit Das,"Sonal Kaushal, Rupa Bhimani, Julie Tejwani, Sabina Malik, Jigna Bharadhwaj, Rajesh Kawa",India,"June 18, 2019",2018,TV-Y7,63 min,Children & Family Movies,"Hoping to find a magical root, a monster has captured farmers in the land of Vyom. It’s up to Bheem and the gang to foil his plan and save the kingdom!",netflix,
s8124,Movie,Super Dark Times,Kevin Phillips,"Owen Campbell, Charlie Tahan, Elizabeth Cappuccino, Max Talisman, Amy Hargreaves, Sawyer Barth, Adea Lennox, Ethan Botwick",United States,"January 1, 2018",2017,TV-MA,104 min,"Dramas, Independent Movies, Thrillers","A tragic accident drives a wedge between two teenage boys, threatening a friendship that had seemed firm and unshakeable.",netflix,6.6
s8125,Movie,Super Nani,Indra Kumar,"Rekha, Randhir Kapoor, Sharman Joshi, Anupam Kher, Shweta Kumar, Varsha Usgaonkar, Rajesh Kumar, Shreya Narayan",India,"March 1, 2018",2014,TV-PG,127 min,"Comedies, Dramas, International Movies","A loving, concerned American grandson travels to Mumbai to rescue his unappreciated grandmother from her drudgery and fulfill her true potential.",netflix,4.7
s8126,TV Show,Super Wings,,"Luca Padovan, Evan Smolin, Junah Jang, Colin Critchley","United States, South Korea, China","December 1, 2020",2020,TV-Y,3 Seasons,"Kids' TV, Korean TV Shows",A cheerful jet and his transforming pals strive to find peaceful solutions to their problems while delivering packages to children around the globe.,netflix,
