show_id,type,title,director,cast,country,date_added,release_year,rating,duration,listed_in,description,platform,imdb_rating
s8127,Movie,Superbad,Greg Mottola,"Jonah Hill, Michael Cera, Christopher Mintz-Plasse, Bill Hader, Seth Rogen, Martha MacIsaac, Emma Stone, Aviva Baumann, Joe Lo Truglio, Kevin Corrigan",United States,"January 1, 2021",2007,R,113 min,"Comedies, Cult Movies","Hoping to have sex before college, high school seniors Seth and Evan try to score booze for a huge party, leading to a series of wild misadventures.",netflix,7.6
s8128,Movie,Superfly,Gordon Parks,"Ron O'Neal, Carl Lee, Sheila Frazier, Julius Harris, Charles McGregor, Nate Adams, Polly Niles, Yvonne Delaine",United States,"November 1, 2019",1972,R,91 min,"Action & Adventure, Classic Movies, Dramas","To get away from the thug life, cocaine dealer Youngblood Priest puts together one last deal that will net him enough money to start over.",netflix,6.4
s8129,Movie,Superman Returns,Bryan Singer,"Brandon Routh, Kate Bosworth, Kevin Spacey, James Marsden, Parker Posey, Frank Langella, Sam Huntington, Eva Marie Saint, Marlon Brando, Kal Penn",United States,"October 1, 2019",2006,PG-13,154 min,"Action & Adventure, Sci-Fi & Fantasy","When Superman returns to Metropolis, he finds that Lois Lane has moved on to another man and Lex Luthor is developing a new plan to rule the world.",netflix,6.0
s8130,TV Show,SuperNature: Wild Flyers,,,United Kingdom,"March 1, 2017",2016,TV-PG,1 Season,"British TV Shows, Docuseries, Science & Nature TV",This series examines the aerodynamics of flight and the evolutionary processes that have enabled certain species to survive by taking to the skies.,netflix,7.8
s8131,Movie,Superstar,Bruce McCulloch,"Molly Shannon, Will Ferrell, Elaine Hendrix, Harland Williams, Mark McKinney, Glynis Johns, Jason Blicker, Gerry Bamman, Emmy Laybourne, Jennifer Irwin, Tom Green",United States,"November 20, 2019",1999,PG-13,82 min,Comedies,A socially awkward Catholic schoolgirl vows to win a dreamy classmate’s affections by taking first prize at an upcoming talent show.,netflix,5.2
s8132,Movie,Surat Dari Praha,Angga Dwimas Sasongko,"Tio Pakusadewo, Julie Estelle, Widyawati, Rio Dewanto, Chicco Jerikho, Jajang C. Noer, Shafira Umm",Indonesia,"October 9, 2018",2016,TV-14,98 min,"Dramas, International Movies, Romantic Movies","Hoping to fulfill her deceased mother's final wish, a young woman travels to Prague to deliver an old letter to a mysterious man.",netflix,7.2
s8133,TV Show,Surviving R. Kelly Part II: The Reckoning,,R. Kelly,United States,"April 13, 2020",2020,TV-MA,1 Season,"Crime TV Shows, Docuseries","As more women come forward with harrowing accusations against R. Kelly, his criminal case gains momentum in this follow-up to the powerful docuseries.",netflix,7.3
s8134,Movie,Survivors Guide to Prison,Matthew Cooke,Susan Sarandon,United States,"May 24, 2018",2017,TV-MA,103 min,Documentaries,"Former inmates, officers and celebrities critique the U.S. prison system in this documentary packaged as a how-to handbook for the incarcerated.",netflix,
s8135,Movie,Susanne Bartsch: On Top,"Anthony Caronna, Alexander Smith",Susanne Bartsch,United States,"December 10, 2018",2017,TV-MA,86 min,"Documentaries, LGBTQ Movies","Beyond her larger-than-life persona, this documentary reveals the woman behind the famed event planner, and her legacy as a cultural icon and activist.",netflix,6.7
s8136,Movie,Sustainable,Matt Wechsler,,United States,"March 1, 2017",2016,TV-G,92 min,Documentaries,"Chef Rick Bayless, farmers and others discuss the history leading to the sustainable food movement and how it could change what we eat in the future.",netflix,7.3
s8137,Movie,Swami,Basu Chatterjee,"Shabana Azmi, Girish Karnad, Vikram, Dheeraj Kumar, Shashikala, Utpal Dutt, Preeti Ganguli, Sudha Shivpuri",India,"December 31, 2019",1977,TV-PG,123 min,"Dramas, Independent Movies, International Movies","After she enters into an arranged marriage, a spirited and intellectual young woman tries to adjust to life with a man who was not her choice.",netflix,6.6
s8138,TV Show,Swami Baba Ramdev: The Untold Story,,"Naman Jain, Kranti Prakash Jha, Tej Sapru, Chetan Pandit, Hitesh Bhardwaj, Sadhil Kapoor",,"May 1, 2018",2018,TV-14,1 Season,"International TV Shows, TV Dramas","Born into poverty and denied an education, a village boy overcomes society’s obstacles to become India’s foremost spiritual guru, revered by millions.",netflix,
s8139,Movie,Sweeney Todd: The Demon Barber of Fleet Street,Tim Burton,"Johnny Depp, Helena Bonham Carter, Alan Rickman, Timothy Spall, Sacha Baron Cohen, Jamie Campbell Bower, Laura Michelle Kelly, Jayne Wisener, Ed Sanders","United States, United Kingdom","January 1, 2020",2007,R,116 min,"Dramas, Horror Movies, Music & Musicals","After being falsely imprisoned, a vengeful murderer covers his tracks by enlisting the help of a baker whose meat pies become the toast of London.",netflix,7.3
s8140,Movie,Sweet Virginia,Jamie M. Dagg,"Jon Bernthal, Christopher Abbott, Imogen Poots, Rosemarie DeWitt, Odessa Young, Joseph Lyle Taylor, Jonathan Tucker, Garry Chalk, Jared Abrahamson, Gabrielle Rose","United States, Canada","December 1, 2019",2017,R,93 min,"Dramas, Independent Movies, Thrillers","In a remote Alaskan town reeling from a sudden triple murder, a former rodeo champ befriends a lone newcomer with a violent occupation.",netflix,6.2
s8141,Movie,Swiss Army Man,"Dan Kwan, Daniel Scheinert","Paul Dano, Daniel Radcliffe, Mary Elizabeth Winstead, Antonia Ribero, Timothy Eulich, Richard Gross, Marika Casteel, Andy Hull, Aaron Marshall, Shane Carruth","United States, Sweden","January 30, 2019",2016,R,97 min,"Comedies, Dramas, Independent Movies",A washed-up corpse with surprising abilities gives a hopeless man stranded in the wilderness someone to talk to – and a newfound reason to live.,netflix,7.0
s8142,Movie,Sword Master,Derek Yee,"Kenny Lin, Peter Ho, Jiang Mengjie, Jiang Yiyan, Paw Hee Ching","China, Hong Kong","June 10, 2017",2016,TV-MA,108 min,"Action & Adventure, Dramas, International Movies","Haunted by the past, a master swordsman masks his identity to work anonymously as a janitor in a brothel, setting in motion a violent chain of events.",netflix,6.1
s8143,Movie,Sword Masters: Two Champions of Shaolin,Cheh Chang,"Meng Lo, Sheng Chiang, Li Wang, Siu-Ho Chin, Feng Lu, Chien Sun, Hsueh-erh Wen, Tai-Ping Yu",Hong Kong,"August 16, 2018",1980,R,101 min,"Action & Adventure, International Movies","Shaolin warrior Tung Chien-chen is injured in battle against the hated Wu Tang clan, and nursed back to health by a knife-throwing master. As he recovers, Tung learns this deadly art, and also falls in love with his teacher's daughter.",netflix,6.3
s8144,TV Show,Sym-Bionic Titan,,"Tara Strong, Kevin Thoms, Brian Posehn, John DiMaggio, Tim Russ, Don Leslie, Kari Wahlgren",United States,"December 15, 2019",2010,TV-PG,1 Season,Kids' TV,"Aliens fleeing their planet land on Earth, pose as teenagers and fight off mutant space monsters by joining forces to become a powerful giant robot.",netflix,8.1
s8145,Movie,Taal,Subhash Ghai,"Anil Kapoor, Aishwarya Rai Bachchan, Akshaye Khanna, Amrish Puri, Alok Nath, Mita Vasisht, Saurabh Shukla, Supriya Karnik",India,"March 1, 2018",1999,TV-PG,177 min,"Dramas, International Movies, Music & Musicals","Businessman Manav falls for aspiring singer Mansi, but their romance faces an uphill climb when Manav must depart and Mansi's suave manager moves in.",netflix,6.7
s8146,Movie,Tahaan,Santosh Sivan,"Purav Bhandare, Anupam Kher, Rahul Bose, Victor Banerjee, Ankush Dubey, Rasika Dugal, Rahul Khanna, Sana Shaikh, Dheirya Sonecha, Fatima Sana Shaikh, Sarika",India,"July 15, 2018",2008,TV-14,95 min,"Dramas, International Movies","After his family's donkey is confiscated by a moneylender, 8-year-old Tahaan travels across conflict-torn Kashmir to find his beloved pet.",netflix,7.1
s8147,Movie,Take Me Home Tonight,Michael Dowse,"Topher Grace, Anna Faris, Dan Fogler, Teresa Palmer, Chris Pratt, Michael Biehn, Jeanie Hackett, Lucy Punch, Michelle Trachtenberg, Demetri Martin","United States, Germany","May 16, 2019",2011,R,97 min,"Comedies, Romantic Movies","Set in the financial boom of the late 1980s, this tale centers on a recent college grad trying to figure out what to do with his life.",netflix,6.3
s8148,TV Show,Taken,,"Clive Standen, Jennifer Beals, Gaius Charles, Brooklyn Sudano, Monique Gabriela Curnen, Michael Irby, James Landry Hébert, Jose Pablo Cantillo, James Landry Hebert","France, United States"," January 12, 2019",2018,TV-14,2 Seasons,"Crime TV Shows, TV Action & Adventure, TV Thrillers","After a personal tragedy upends his life, a highly skilled former Green Beret is drawn into a career as a secret government operative.",netflix,
s8149,TV Show,Tales of the City (1993),,"Olympia Dukakis, Donald Moffat, Laura Linney, Marcus D'Amico, Billy Campbell, Thomas Gibson, Paul Gross, Barbara Garrick, Chloe Webb, Nina Foch, Parker Posey, Stanley DeSantis","United Kingdom, United States","June 28, 2019",1993,TV-MA,1 Season,TV Dramas,"In 1976, naive Mary Ann Singleton moves to San Francisco and finds a new family in her bohemian landlady and the eclectic residents at 28 Barbary Lane.",netflix,8.3
s8150,Movie,Tamanchey,Navneet Behal,"Nikhil Dwivedi, Richa Chadha, Damandeep Singh Baggan, Vijay Pande, Talib Mehdi, Tushar Phulke, Mahesh Gupta, Prasad Labhe",India,"October 15, 2017",2014,TV-MA,111 min,"Action & Adventure, International Movies, Romantic Movies",A man and a woman on the run from the law are drawn to each other through the common bond of their mutual dependency.,netflix,4.5
s8151,Movie,Tarif de nuit,Julien Seri,"Jonathan Howard, Jonathan Demurger, Fanny Valette, Jess Liaudin",France,"March 1, 2018",2015,TV-MA,81 min,"International Movies, Thrillers","A night out in Paris quickly unravels when two friends provoke the wrong taxi driver, who's after something bigger than cab fare.",netflix,5.5
s8152,Movie,Tarzan,"Chris Buck, Kevin Lima","Tony Goldwyn, Minnie Driver, Glenn Close, Brian Blessed, Nigel Hawthorne, Rosie O'Donnell, Lance Henriksen, Wayne Knight, Alex D. Linz",United States,"June 23, 2018",1999,G,89 min,Children & Family Movies,"After being shipwrecked off the African coast, a lone child grows up in the wild, and is destined to become lord of the jungle.",netflix,7.3
s8153,Movie,Tarzan 2,Brian Smith,"Harrison Chad, George Carlin, Brad Garrett, Ron Perlman, Estelle Harris, Glenn Close, Lance Henriksen, Brenda Grate, Harrison Fahn",United States,"June 23, 2017",2005,G,72 min,Children & Family Movies,How did the King of the Jungle ascend to the throne? Find out in this charming prequel to the hit animated movie that catches Tarzan as a young child.,netflix,5.6
s8154,Movie,Tattah,Sameh Abdulaziz,"Mohamed Saad, Dolly Shahin, Marwa, Hayatem, Sayed Rajab, Omar Mustafa Metwally, Samy Maghawry, Nabil Issa, Ragaa Al-Geddawy, Samir Ghanem",Egypt,"May 9, 2019",2013,TV-14,112 min,"Comedies, International Movies",A down-on-his-luck man must prove he's not as hapless as he seems when the woman he's on a date with is suddenly kidnapped.,netflix,4.3
s8155,Movie,Tayo the Little Bus Movie: Mission Ace,Ryu Jung-woo,"Moon Nam-sook, Jeong Hye-ok, Choe Hana, Gim Yeong-seon",United States,"July 1, 2019",2016,TV-Y7,48 min,Children & Family Movies,"After he loses his favorite racing car, Duri ventures to a mysterious, magical land filled with toys that have been thrown away.",netflix,4.8
s8156,Movie,Teach Us All,Sonia Lowman,,United States,"September 25, 2017",2017,TV-14,81 min,Documentaries,"It's been decades since Brown v. Board of Education, yet American schools remain largely segregated. Some leaders are working to change that.",netflix,
s8157,Movie,Teen Patti,Leena Yadav,"Amitabh Bachchan, Madhavan, Ben Kingsley, Shraddha Kapoor, Siddharth Kher, Dhruv Ganesh, Vaibhav Talwar",India,"March 1, 2018",2010,TV-PG,137 min,"Dramas, International Movies, Thrillers","Luck brings together math expert Perci Trachtenberg and obscure genius Venkat Subramaniam in a casino, but the foundations of probability may be utterly altered when their chat leads Subramaniam to try a new theory in the gambling dens of Mumbai.",netflix,4.1
s8158,Movie,Teenage Cocktail,John Carchietta,"Nichole Bloom, Fabianne Therese, Michelle Borth, Pat Healy, AJ Bowen, Joshua Leonard",United States,"January 15, 2017",2016,TV-MA,89 min,"Dramas, Independent Movies, LGBTQ Movies","Two teen girls form an intense bond and launch a lucrative webcam business, leading them to a dangerous encounter with a middle-aged married man.",netflix,5.8
s8159,Movie,Teenage Mutant Ninja Turtles,Kevin Munroe,"Chris Evans, Sarah Michelle Gellar, Mako Iwamatsu, Kevin Smith, Patrick Stewart, Zhang Ziyi, Laurence Fishburne, Mitchell Whitfield, James Arnold Taylor, Mikey Kelley, Nolan North","Hong Kong, United States","May 1, 2019",2007,PG,87 min,"Children & Family Movies, Comedies","In this animated adventure, Master Splinter whips the four Ninja Turtles back into shape to defeat monsters running amok in New York.",netflix,6.2
s8160,Movie,Teenage Mutant Ninja Turtles II: The Secret of the Ooze,Michael Pressman,"Paige Turco, David Warner, Mark Caso, Michelan Sisti, Leif Tilden, Kenn Scott, Kevin Clash, Ernie Reyes Jr., François Chau, Kevin Nash","United States, Hong Kong","January 1, 2020",1991,PG,88 min,"Children & Family Movies, Comedies","The evil Shredder decides that ooze is what gives the ninja turtles their power, so he obtains some of the toxic junk and creates dangerous mutants.",netflix,6.0
s8161,Movie,Teenage Mutant Ninja Turtles: The Movie,Steve Barron,"Judith Hoag, Elias Koteas, Josh Pais, Michelan Sisti, Leif Tilden, David Forman, Michael Turney, Jay Patterson, Raymond Serra, James Saito, Kevin Clash",,"January 1, 2020",1990,PG,94 min,"Action & Adventure, Comedies","After exposure to a strange, glowing ooze, four mutant turtles train as ninjas in the sewers and fight crime wherever they find it.",netflix,6.8
s8162,Movie,Tees Maar Khan,Farah Khan,"Katrina Kaif, Akshay Kumar, Akshaye Khanna, Arya Babbar, Rajiv Lakshman, Raghu Ram, Vijay Maurya, Dharampal, Ali Asghar, Murli Sharma",India,"August 2, 2018",2010,TV-PG,125 min,"Comedies, International Movies, Music & Musicals",A flamboyant con artist and his band of gleeful robbers gamble with fate when smugglers hire them to swipe antiques from a speeding train.,netflix,2.6
s8163,Movie,Tellur Aliens,Einar Gabbassov,,"United States, Kazakhstan","December 1, 2016",2016,TV-Y7,67 min,Children & Family Movies,Three teenaged best friends on the planet Telluria begin an incredible journey of adventure as they fight against the most evil being in the universe.,netflix,4.4
s8164,Movie,Temporada de Caza,Natalia Garagiola,"Germán Palacios, Lautaro Bettoni, Boy Olmi, Rita Pauls, Pilar Benitez Vibart, Diana Szeinblum","Argentina, France, United States, Germany, Qatar","July 15, 2018",2017,TV-MA,108 min,"Dramas, International Movies",Animosity gives way to love and forgiveness when an angry teenager reunites with his estranged biological father in the wilds of Patagonia.,netflix,6.3
s8165,Movie,Ten Years,"Jevons Au, Zune Kwok, Chow Kwun-wai, Ng Ka-Leung, Wong Fei-Pang","Wong Jing, Lau Ho-Chi, Leung Kin-Ping",Hong Kong,"February 12, 2019",2015,TV-MA,102 min,"Dramas, Independent Movies, International Movies","Five shorts reveal a fictional Hong Kong in 2025, depicting a dystopian city where residents and activists face crackdowns under iron-fisted rule.",netflix,6.8
s8166,TV Show,Teresa,,"Angelique Boyer, Sebastián Rulli, Aarón Díaz, Cynthia Klitbo, Ana Brenda Contreras, Daniel Arenas, Margarita Magaña, Manuel Landeta, Felicia Mercado, Silvia Mariscal",Mexico,"December 31, 2017",2010,TV-PG,1 Season,"International TV Shows, Romantic TV Shows, Spanish-Language TV Shows","We all want so much more than we have, but how far are we willing to go to get it?",netflix,7.8
s8167,Movie,Terminator 3: Rise of the Machines,Jonathan Mostow,"Arnold Schwarzenegger, Nick Stahl, Claire Danes, Kristanna Loken, David Andrews, Mark Famiglietti, Earl Boen, Moira Sinise, Chopper Bernet, Christopher Lawford","United States, Germany, United Kingdom","January 1, 2020",2003,R,109 min,"Action & Adventure, Sci-Fi & Fantasy","Ten years after John Connor saved Earth from Judgment Day, he encounters T-X, a robotic assassin ordered to finish what T-1000 started.",netflix,6.3
s8168,Movie,Terminator Salvation,McG,"Christian Bale, Sam Worthington, Moon Bloodgood, Helena Bonham Carter, Anton Yelchin, Jadagrace, Bryce Dallas Howard, Common, Jane Alexander, Michael Ironside","United States, Germany, United Kingdom, Italy","January 1, 2020",2009,PG-13,115 min,"Action & Adventure, Sci-Fi & Fantasy","All grown up in post-apocalyptic 2018, John Connor must lead the resistance of humans against increasingly dominating militaristic robots.",netflix,6.5
s8169,Movie,Terra,"Yann Arthus-Bertrand, Michael Pitiot",Vanessa Paradis,France,"May 1, 2016",2015,TV-PG,98 min,"Documentaries, International Movies",This visually arresting documentary essay reflects on our relationship to other living creatures as humanity becomes more isolated from nature.,netflix,
s8170,Movie,Terrifier,Damien Leone,"Jenna Kanell, Samantha Scaffidi, David Howard Thornton, Catherine Corcoran, Pooya Mohseni, Matt McAllister, Katie Maguire, Gino Cafarelli, Cory DuVal, Michael Leavy",United States,"September 1, 2018",2017,TV-MA,84 min,"Horror Movies, Independent Movies, Thrillers","On Halloween night, inside a dilapidated apartment building, Art the Clown stalks his victims, slicing and slaughtering in terrifying silence.",netflix,
s8171,Movie,Teshan,Sukhbir Singh,"Happy Raikoti, Diljott, Prince Kanwaljit Singh, Karamjit Anmol, Harinder Bhullar, Virast Sandhu, Anita Devgan, Simran Sehajpal",India,"October 15, 2017",2016,TV-PG,133 min,"Comedies, International Movies, Romantic Movies",New beginnings appear to be on the horizon after a simple country boy forms a bond with a sophisticated urban girl with modern ideas.,netflix,5.3
s8172,Movie,Tezz,Priyadarshan,"Anil Kapoor, Ajay Devgn, Boman Irani, Kangna Ranaut, Zayed Khan, Mallika Sherawat, Avika Gor, Dominic Power, Sameera Reddy, Mohanlal","United Kingdom, India","December 1, 2017",2012,TV-MA,121 min,"Action & Adventure, International Movies, Music & Musicals",This high-octane thriller tells the story of a man on a mission to reclaim what was taken from him and the agent who's determined to stop him.,netflix,3.9
s8173,TV Show,Th Eena Meena Deeka Chase Comedy Show,Dheeraj Berry,"Sanjay Keni, Priya Raina",India,"March 31, 2018",2015,TV-Y7,1 Season,"Kids' TV, TV Comedies","A hungry fox and three resourceful, surprisingly formidable birds turn the animal kingdom on its head in this lively animated series.",netflix,
s8174,TV Show,Thackeray,,,India,"May 25, 2019",2019,TV-MA,1 Season,TV Shows,"From controversial cartoonist to powerful Mumbai politician, this biopic maps the meteoric rise of far-right Shiv Sena party founder, Bal Thackeray.",netflix,5.3
s8175,TV Show,That '70s Show,,"Topher Grace, Mila Kunis, Ashton Kutcher, Danny Masterson, Laura Prepon, Wilmer Valderrama, Debra Jo Rupp, Kurtwood Smith, Don Stark, Tanya Roberts, Tommy Chong, Lisa Robin Kelly",United States," November 1, 2017",2005,TV-14,8 Seasons,TV Comedies,"Feel groovy in 1970s suburbia, where a teen and his pals hang in the basement, listening to rock and indulging other hazy benefits of '70s culture.",netflix,7.3
s8176,TV Show,The 2000s,,,United States,"February 19, 2019",2018,TV-MA,1 Season,Docuseries,"Examine the triumphs, tragedies, cultural shifts and technological leaps that occurred during the millennium's first decade.",netflix,8.1
s8177,Movie,The 24 Hour War,"Nate Adams, Adam Carolla",,United States,"November 15, 2019",2016,TV-MA,100 min,"Documentaries, Sports Movies",An intense rivalry between Henry Ford II of the Ford Motor Company and Enzo Ferrari results in the most epic showdown in racing history.,netflix,7.2
s8178,Movie,The 4th Company,"Mitzi Vanessa Arreola, Amir Galvan Cervera","Adrian Ladron, Andoni Gracia, Hernán Mendoza, Gabino Rodríguez, Darío T. Pie, Manuel Ojeda","Mexico, Spain","April 6, 2018",2016,TV-MA,117 min,"Action & Adventure, Dramas, International Movies","In a violent prison in 1970s Mexico, a young inmate lands a spot on a football team that doubles as an enforcer squad for a corrupt administration.",netflix,6.2
s8179,Movie,The Accountant of Auschwitz,Matthew Shoychet,,Canada,"July 1, 2019",2018,TV-14,78 min,"Documentaries, International Movies","Decades after WWII, a former SS officer stands trial in his native Germany after being charged for his complicity in the murder of Jews at Auschwitz.",netflix,7.3
s8180,Movie,The Adderall Diaries,Pamela Romanowsky,"James Franco, Ed Harris, Amber Heard, Jim Parrack, Timothée Chalamet, Wilmer Valderrama, Cynthia Nixon, Christian Slater, Michael Cristofer, Danny Flaherty, Adam LeFevre",United States,"July 15, 2018",2015,R,87 min,"Dramas, Thrillers",Author Stephen Elliott has a problem separating his own life from incidents in the life of a convicted murderer about whom he's writing a book.,netflix,5.1
s8181,TV Show,The Adjusters,,"Rynn Lim, Chris Tong, Aric Ho, Chan Fong",,"September 18, 2017",2010,TV-PG,2 Seasons,"International TV Shows, TV Dramas","An insurance adjuster investigates cases of possible fraud while hiding a romance with a colleague, unaware that someone he trusts is toying with him.",netflix,
s8182,Movie,The Adventure Club,Geoff Anderson,"Sam Ashe Arnold, Jakob Davies, Dalila Bela, Robin Dunne, Gabrielle Miller, Billy Zane, Josh McDonald, Lorne Cardinal, Kim Coates, Glenn Paradis",Canada,"May 10, 2017",2016,TV-Y7,88 min,Children & Family Movies,"After finding a peculiar key, three smart and adventurous kids launch a quest to uncover the whereabouts of a coveted archaeological treasure.",netflix,
s8183,TV Show,The Adventures of Figaro Pho,,"Luke Jurevicius, Craig Behenna, Charlotte Hamlyn, Stavroula Mountzouris, Aletheia Burney",Australia,,2015,TV-Y7,2 Seasons,"Kids' TV, TV Comedies","Imagine your worst fears, then multiply them: Figaro is a boy with any number of phobias and a highly quirky and imaginative way of dealing with them.",netflix,7.3
s8184,Movie,The Adventures of Sharkboy and Lavagirl,Robert Rodriguez,"Taylor Lautner, Taylor Dooley, Cayden Boyd, George Lopez, David Arquette, Kristin Davis, Jacob Davich, Sasha Pieterse, Rico Torres",United States,"December 2, 2020",2005,PG,93 min,Children & Family Movies,A 10-year-old dreamer's imaginary friends – mighty Sharkboy and fire-producing Lavagirl – come to life to seek his help battling a nefarious baddie.,netflix,3.7
s8185,Movie,The Adventures of Tintin,Steven Spielberg,"Jamie Bell, Andy Serkis, Daniel Craig, Nick Frost, Simon Pegg, Daniel Mays, Gad Elmaleh, Toby Jones, Joe Starr","United States, New Zealand, United Kingdom","November 20, 2019",2011,PG,107 min,Children & Family Movies,"This 3-D motion capture adapts Georges Remi's classic comic strip about the adventures of fearless young journalist Tintin and his trusty dog, Snowy.",netflix,7.3
s8186,Movie,The Aerial,Esteban Sapir,"Rafael Ferro, Sol Moreno, Jonathan Sandor, Alejandro Urdapilleta, Julieta Cardinali, Florencia Raggi, Valeria Bertuccelli, Raúl Hochman, Ricardo Merkin, Carlos Piñeyro",Argentina,"April 1, 2018",2007,TV-MA,99 min,"Dramas, International Movies, Sci-Fi & Fantasy","In the City Without a Voice, only faceless singer the Voice can still vocalize. Everyone else has lost the power of speech as they let Mr. TV's broadcasts speak for them. But when Mr. TV kidnaps the Voice, things change.",netflix,7.4
s8187,Movie,The Age of Shadows,Jee-woon Kim,"Kang-ho Song, Gong Yoo, Ji-min Han, Tae-goo Eom, Sung-rok Shin, Hee-soon Park, Young-ju Seo, Song Kang-ho",South Korea,"January 1, 2018",2016,TV-MA,140 min,"Action & Adventure, Dramas, International Movies","Formerly a Korean resistance fighter, a policeman working for Japan is tasked with tracking down resistance leaders before they acquire explosives.",netflix,7.1
s8188,Movie,The American President,Rob Reiner,"Michael Douglas, Annette Bening, Martin Sheen, Michael J. Fox, David Paymer, Samantha Mathis, John Mahoney, Anna Deavere Smith, Nina Siemaszko, Wendie Malick, Shawna Waldron, Richard Dreyfuss, Joshua Malina",United States,"January 1, 2021",1995,PG-13,113 min,"Comedies, Dramas, Romantic Movies",The widowed president strikes up a romance with a beautiful Washington lobbyist – but can the couple keep their private and political lives separate?,netflix,6.8
s8189,Movie,The Amityville Horror,Andrew Douglas,"Ryan Reynolds, Melissa George, Chloë Grace Moretz, Jesse James, Jimmy Bennett, Rachel Nichols, Philip Baker Hall, Isabel Conner, Brendan Donaldson, Annabel Armour",United States,"January 1, 2020",2005,R,89 min,Horror Movies,"This hair-raising remake of the 1979 horror hit depicts the ordeal of the Lutz family, whose new home has a gory past and a legacy of demons.",netflix,6.0
s8190,TV Show,The Andy Griffith Show,,"Andy Griffith, Ron Howard, Don Knotts, Frances Bavier, Howard McNear, Hope Summers",United States," July 1, 2017",1967,TV-G,8 Seasons,"Classic & Cult TV, TV Comedies","Homespun humor and easygoing Sheriff Andy Taylor are at the center of this nostalgic look at Mayberry, a small town filled with lovable characters.",netflix,
s8191,Movie,The Angry Birds Movie 2,"Thurop Van Orman, John Rice","Jason Sudeikis, Rachel Bloom, Leslie Jones, Josh Gad, Bill Hader, Danny McBride, Awkwafina, Sterling K. Brown, Tiffany Haddish, Eugenio Derbez","Finland, United States","February 27, 2020",2019,PG,97 min,"Children & Family Movies, Comedies",Enemies turn into frenemies when the Pigs call for a truce with the Birds to unite against a formidable new foe that’s threatening all of their homes.,netflix,6.4
